"question","option_1","option_2","option_3","correct_index","explanation"
"What is a sensitive variable that can lead to bias?","Education level","Country","Gender","2","The correct answer is:C - Gender is a sensitive variable that can introduce bias if used inappropriately, as it may lead to discriminatory outcomes in AI models."
"What is one technique to mitigate bias and ensure fairness in AI applications?","Ongoing auditing and monitoring of data that is used in AI applications","Excluding data features from the AI application to benefit a population","Using data that contains more examples of minority groups than majority groups","0","The correct answer is:A - Ongoing auditing and monitoring of data help identify and mitigate bias, ensuring fairness by detecting issues in real-time."
"What is the best method to safeguard customer data privacy?","Automatically anonymize all customer data.","Track customer data consent preferences.","Archive customer data on a recurring schedule.","1","The correct answer is:B - Tracking customer data consent preferences ensures compliance with privacy regulations and respects customer choices, safeguarding privacy effectively."
"What does the term 'data completeness' refer to in the context of data quality?","The degree to which all required data points are present in the dataset","The process of aggregating multiple datasets from various databases","The ability to access data from multiple sources in real time","0","The correct answer is:A - Data completeness refers to the presence of all required data points in a dataset, ensuring no critical information is missing for analysis."
"What is machine learning?","AI that can grow its intelligence","AI that creates new content","A data model used in Salesforce","0","The correct answer is:A - Machine learning is a subset of AI where algorithms learn from data to make decisions or predictions, improving over time with more data."
"Which type of bias imposes a system’s values on others?","Association","Automation","Societal","2","The correct answer is:C - Societal bias imposes societal values or stereotypes on AI outputs, leading to unfair or discriminatory results."
"What should organizations do to ensure data quality for their AI initiatives?","Collect and curate high-quality data from reliable sources.","Rely on AI algorithms to automatically handle data quality issues.","Prioritize model fine-tuning over data quality improvements.","0","The correct answer is:A - Collecting and curating high-quality data from reliable sources is essential for ensuring accurate and unbiased AI outcomes."
"Cloud Kicks uses Einstein to generate predictions but is not seeing accurate results? What is a potential reason for this?","Poor data quality","The wrong product","Too much data","0","The correct answer is:A - Poor data quality, such as inaccuracies or incompleteness, is a common reason for inaccurate AI predictions, as models rely on data to learn patterns."
"How does AI assist in lead qualification?","Scores leads based on customer data","Creates personalized SMS campaigns","Automatically interacts with prospects","0","The correct answer is:A - AI assists in lead qualification by scoring leads based on customer data, helping sales teams prioritize high-potential prospects."
"Which AI tool is a web of connections, guided by weights and biases?","Neural networks","Predictive Analytics","Rules-based systems","0","The correct answer is:A - Neural networks are AI models composed of interconnected nodes with weights and biases, used for complex pattern recognition and decision-making."
"How does poor data quality affect predictive and generative AI models?","Creates inaccurate results","Increases raw data volume","Decreases storage efficiency","0","The correct answer is:A - Poor data quality leads to inaccurate results in both predictive and generative AI models, as they rely on reliable data to produce correct outputs."
"What is the significance of explainability of trusted AI systems?","Increases the complexity of AI models","Enhances the security and accuracy of AI models","Describes how AI models make decisions","2","The correct answer is:C - Explainability in trusted AI systems involves describing how models make decisions, fostering transparency and user trust."
"A consultant conducts a series of Consequence Scanning workshops to support testing diverse datasets. Which Salesforce Trusted AI Principles is being practiced?","Transparency","Inclusivity","Accountability","1","The correct answer is:B - Testing diverse datasets aligns with the Inclusivity principle, ensuring AI systems are fair and representative of varied populations."
"Which action should be taken to develop and implement trusted generative AI with Salesforce's safety guideline in mind?","Develop right-sized models to reduce our carbon footprint.","Create guardrails that mitigate toxicity and protect PII","Be transparent when AI has created and automatically delivered content.","1","The correct answer is:B - Creating guardrails to mitigate toxicity and protect personally identifiable information (PII) ensures safe and ethical generative AI use."
"Cloud Kicks' latest email campaign is struggling to attract new customers. How can AI increase the company's customer email engagement?","Create personalized emails","Resend emails to inactive recipients","Remove invalid email addresses","0","The correct answer is:A - AI can increase email engagement by creating personalized emails tailored to customer preferences, improving relevance and response rates."
"How does data quality impact the trustworthiness of AI-driven decisions?","The use of both low-quality and high-quality data can improve the accuracy and reliability of AI-driven decisions.","High-quality data improves the reliability and credibility of AI-driven decisions, fostering trust among users.","Low-quality data reduces the risk of overfitting the model, improving the trustworthiness of the predictions.","1","The correct answer is:B - High-quality data ensures reliable and credible AI-driven decisions, building trust by reducing errors and biases."
"Cloud Kicks discovered multiple variations of state and country values in contact records. Which data quality dimension is affected by this issue?","Usage","Accuracy","Consistency","2","The correct answer is:C - Multiple variations of state and country values indicate a lack of consistency, as the data is not uniformly formatted across records."
"What is a key consideration regarding data quality in AI implementation?","Techniques from customizing AI features in Salesforce","Data’s role in training and fine-tuning Salesforce AI models","Integration process of AI models with Salesforce workflows","1","The correct answer is:B - Data quality is critical in training and fine-tuning AI models, as it directly affects the accuracy and fairness of the models’ outputs."
"What is the main focus of the Accountability principle in Salesforce's Trusted AI Principles?","Safeguarding fundamental human rights and protecting sensitive data","Taking responsibility for one’s actions toward customers, partners, and society","Ensuring transparency in AI-driven recommendations and predictions","1","The correct answer is:B - The Accountability principle emphasizes taking responsibility for AI actions and their impact on customers, partners, and society."
"A sales manager wants to improve their processes using AI in Salesforce? Which application of AI would be most beneficial?","Lead scoring and opportunity forecasting","Sales dashboards and reporting","Data modeling and management","0","The correct answer is:A - Lead scoring and opportunity forecasting use AI to prioritize high-value leads and predict sales outcomes, directly improving sales processes."
"What is a benefit of data quality and transparency as it pertains to bias in generated AI?","Chances of bias are mitigated","Chances of bias are aggravated","Chances of bias are removed","0","The correct answer is:A - High data quality and transparency help mitigate bias in generative AI by ensuring fair data inputs and clear decision-making processes."
"Cloud Kicks is testing a new AI model. Which approach aligns with Salesforce's Trusted AI Principle of Inclusivity?","Test only with data from a specific region or demographic to limit the risk of data leaks.","Rely on a development team with uniform backgrounds to assess the potential societal implications of the model.","Test with diverse and representative datasets appropriate for how the model will be used.","2","The correct answer is:C - Testing with diverse and representative datasets aligns with Inclusivity, ensuring the model performs fairly across different groups."
"What is the most likely impact that high-quality data will have on customer relationships?","Increased brand loyalty","Higher customer acquisition costs","Improved customer trust and satisfaction","2","The correct answer is:C - High-quality data enables accurate and personalized customer interactions, improving trust and satisfaction."
"A developer has a large amount of data, but it is scattered across different systems and is not standardized. Which key data quality element should they focus on to ensure the effectiveness of the AI models?","Performance","Consistency","Volume","1","The correct answer is:B - Consistency is critical when data is scattered and not standardized, as it ensures uniformity across systems for effective AI model training."
"Cloud Kicks learns of complaints from customers who are receiving too many sales calls and emails. Which data quality dimension should be assessed to reduce these communication inefficiencies?","Duplication","Usage","Consent","0","The correct answer is:A - Duplication in customer records can lead to multiple communications to the same customer, causing inefficiencies and annoyance."
"Cloud Kicks wants to ensure that multiple records for the same customer are removed in Salesforce. Which feature should be used to accomplish this?","Duplicate management","Trigger deletion of old records","Standardized field names","0","The correct answer is:A - Duplicate management in Salesforce identifies and merges duplicate records, ensuring a single, accurate customer profile."
"A business analyst (BA) wants to improve business by enhancing their sales processes and customer support. Which AI application should the BA use to meet their needs?","Sales data cleansing and customer support data governance","Machine learning models and chatbot predictions","Lead scoring, opportunity forecasting, and case classification","2","The correct answer is:C - Lead scoring, opportunity forecasting, and case classification directly enhance sales and support by prioritizing leads, predicting outcomes, and streamlining case handling."
"What are the potential consequences of an organization suffering from poor data quality?","Low employee morale, stock devaluation, and inability to attract top talent","Revenue loss, poor customer service, and reputational damage","Technical debt, monolithic system architecture, and slow ETL throughput","1","The correct answer is:B - Poor data quality can lead to revenue loss (from inaccurate decisions), poor customer service (due to errors), and reputational damage (from mistrust)."
"Cloud Kicks wants to optimize its business operations by incorporating AI into its CRM. What should the company do first to prepare its data for use with AI?","Remove biased data.","Determine data availability.","Determine data outcomes.","1","The correct answer is:B - Determining data availability is the first step to assess what data exists and can be used for AI, ensuring a solid foundation."
"Cloud Kicks plans to use automated chat as its primary support channel. Which Einstein feature should they use?","Discovery","Bots","Next Best Action","1","The correct answer is:B - Einstein Bots enable automated chat support, handling customer queries and reducing the need for human intervention."
"What role does data quality play in the ethical use of AI applications?","Low-quality data reduces the risk of unintended bias as the data is not overfitted to demographic groups.","High-quality data is essential for ensuring unbiased and fair AI decisions, promoting ethical use, and preventing discrimination","High-quality data ensures the process of demographic attributes requires for personalized campaigns.","1","The correct answer is:B - High-quality data prevents bias and ensures fair AI decisions, promoting ethical use by reducing errors and discrimination risks."
"Which action introduces bias in the training data used for AI algorithms?","Using a large dataset that is computationally expensive","Using a dataset that represents diverse perspectives and populations","Using a dataset that underrepresents perspectives and populations","2","The correct answer is:C - Underrepresenting certain perspectives or populations in the dataset introduces bias by skewing the model toward overrepresented groups."
"What is a key benefit of effective interaction between humans and AI systems?","Leads to more informed and balanced decision making","Alerts humans to the presence of biased data","Reduces the need for human involvement","0","The correct answer is:A - Effective human-AI interaction combines human judgment with AI insights, leading to more informed and balanced decisions."
